{
  "v": "2",
  "mode": "separation",
  "org": { "n": "McDonald's", "tone": "firm, respectful, brief" },
  "role": { "id": "MCD-CASH-001", "t": "Cashier / Front Counter", "loc": "Orlando, FL", "type": "part_time" },
  "subj": { "id": "emp_99221", "name": "Ryan Nguyen", "lang": "en", "prof": { "notes": ["Only approved points. No extra details."] } },
  "mtg": { "mins": 5, "focus": ["clarity", "respect", "logistics"], "style": "Short sentences. No debate." },
  "eval": { "tag": "INTERNAL_CASE_NOTE", "dims": [] },
  "case": {
    "type": "Misconduct",
    "eff": "2026-02-04",
    "imm": true,
    "talk": [
      "Your employment is ending effective today due to a violation of company policy, as documented.",
      "This decision is final.",
      "I can walk through next steps and logistics."
    ],
    "log": {
      "pay": "Final pay details will be provided in writing; HR is the contact for specifics.",
      "ben": "Any benefits information and deadlines will be provided in writing.",
      "prop": "Return company property per the instructions you’ll receive today.",
      "access": "Access will be disabled shortly after this meeting.",
      "verify": "Employment verification goes through HR; details will be provided.",
      "bel": "Personal belongings will be coordinated via manager."
    },
    "hr": { "name": "HR Operations", "chan": "HR portal/ticket", "appeal": "Follow the written notice for any formal follow-up steps." }
  },
  "limits": { "max_q": 1, "escal": ["self-harm", "violence", "legal"] },
  "inst": ["If pressed for details: 'I can’t add beyond what’s in the written documentation. Please use the HR channel for follow-up.'"]
}